{
 "schema": "visitflow/problem",
 "version": "2.2",
 "inputs_hash": "sha256:f1c527335b69563d903c8d1644607b2dbfeaabcc27bb90cff7d642c81cfb759b",
 "line_id": "05",
 "cycle": {
  "n_days": 23
 },
 "stores": [
  {
   "id": 0,
   "code": "30000663985",
   "lon": 113.270763,
   "lat": 23.100368,
   "frequency": {
    "horizon": 5,
    "visits": 1,
    "observed_visits": 4,
    "candidate_horizons": [
     5
    ],
    "ambiguous": false,
    "source": "derived"
   }
  },
  {
   "id": 1,
   "code": "30000665845",
   "lon": 113.285461,
   "lat": 23.102396,
   "frequency": {
    "horizon": 5,
    "visits": 1,
    "observed_visits": 4,
    "candidate_horizons": [
     5
    ],
    "ambiguous": false,
    "source": "derived"
   }
  },
  {
   "id": 2,
   "code": "30000666105",
   "lon": 113.269886,
   "lat": 23.098956,
   "frequency": {
    "horizon": 5,
    "visits": 1,
    "observed_visits": 4,
    "candidate_horizons": [
     5
    ],
    "ambiguous": false,
    "source": "derived"
   }
  },
  {
   "id": 3,
   "code": "30000666402",
   "lon": 113.269902,
   "lat": 23.093359,
   "frequency": {
    "horizon": 5,
    "visits": 1,
    "observed_visits": 4,
    "candidate_horizons": [
     5
    ],
    "ambiguous": false,
    "source": "derived"
   }
  },
  {
   "id": 4,
   "code": "30000666908",
   "lon": 113.27587,
   "lat": 23.094875,
   "frequency": {
    "horizon": 5,
    "visits": 1,
    "observed_visits": 4,
    "candidate_horizons": [
     5
    ],
    "ambiguous": false,
    "source": "derived"
   }
  },
  {
   "id": 5,
   "code": "30000698054",
   "lon": 113.272986,
   "lat": 23.103276,
   "frequency": {
    "horizon": 5,
    "visits": 1,
    "observed_visits": 4,
    "candidate_horizons": [
     5
    ],
    "ambiguous": false,
    "source": "derived"
   }
  },
  {
   "id": 6,
   "code": "30000429547",
   "lon": 113.283662,
   "lat": 23.094069,
   "frequency": {
    "horizon": 5,
    "visits": 1,
    "observed_visits": 4,
    "candidate_horizons": [
     5
    ],
    "ambiguous": false,
    "source": "derived"
   }
  },
  {
   "id": 7,
   "code": "20000261632",
   "lon": 113.270268,
   "lat": 23.092928,
   "frequency": {
    "horizon": 5,
    "visits": 1,
    "observed_visits": 4,
    "candidate_horizons": [
     5
    ],
    "ambiguous": false,
    "source": "derived"
   }
  },
  {
   "id": 8,
   "code": "20000284198",
   "lon": 113.275244,
   "lat": 23.10457,
   "frequency": {
    "horizon": 5,
    "visits": 1,
    "observed_visits": 4,
    "candidate_horizons": [
     5
    ],
    "ambiguous": false,
    "source": "derived"
   }
  },
  {
   "id": 9,
   "code": "20000284200",
   "lon": 113.276312,
   "lat": 23.103977,
   "frequency": {
    "horizon": 5,
    "visits": 1,
    "observed_visits": 4,
    "candidate_horizons": [
     5
    ],
    "ambiguous": false,
    "source": "derived"
   }
  },
  {
   "id": 10,
   "code": "20000786253",
   "lon": 113.270387,
   "lat": 23.097637,
   "frequency": {
    "horizon": 5,
    "visits": 1,
    "observed_visits": 4,
    "candidate_horizons": [
     5
    ],
    "ambiguous": false,
    "source": "derived"
   }
  },
  {
   "id": 11,
   "code": "30000036776",
   "lon": 113.268993,
   "lat": 23.101819,
   "frequency": {
    "horizon": 5,
    "visits": 1,
    "observed_visits": 4,
    "candidate_horizons": [
     5
    ],
    "ambiguous": false,
    "source": "derived"
   }
  },
  {
   "id": 12,
   "code": "30000037381",
   "lon": 113.274658,
   "lat": 23.096616,
   "frequency": {
    "horizon": 5,
    "visits": 1,
    "observed_visits": 4,
    "candidate_horizons": [
     5
    ],
    "ambiguous": false,
    "source": "derived"
   }
  },
  {
   "id": 13,
   "code": "30000252036",
   "lon": 113.267518,
   "lat": 23.092336,
   "frequency": {
    "horizon": 5,
    "visits": 1,
    "observed_visits": 4,
    "candidate_horizons": [
     5
    ],
    "ambiguous": false,
    "source": "derived"
   }
  },
  {
   "id": 14,
   "code": "30000665787",
   "lon": 113.285859,
   "lat": 23.106319,
   "frequency": {
    "horizon": 5,
    "visits": 1,
    "observed_visits": 4,
    "candidate_horizons": [
     5
    ],
    "ambiguous": false,
    "source": "derived"
   }
  },
  {
   "id": 15,
   "code": "30000666023",
   "lon": 113.286404,
   "lat": 23.099804,
   "frequency": {
    "horizon": 5,
    "visits": 1,
    "observed_visits": 4,
    "candidate_horizons": [
     5
    ],
    "ambiguous": false,
    "source": "derived"
   }
  },
  {
   "id": 16,
   "code": "30000666051",
   "lon": 113.27015,
   "lat": 23.098719,
   "frequency": {
    "horizon": 5,
    "visits": 1,
    "observed_visits": 4,
    "candidate_horizons": [
     5
    ],
    "ambiguous": false,
    "source": "derived"
   }
  },
  {
   "id": 17,
   "code": "30000666414",
   "lon": 113.270414,
   "lat": 23.092995,
   "frequency": {
    "horizon": 5,
    "visits": 1,
    "observed_visits": 4,
    "candidate_horizons": [
     5
    ],
    "ambiguous": false,
    "source": "derived"
   }
  },
  {
   "id": 18,
   "code": "30000666462",
   "lon": 113.268042,
   "lat": 23.094142,
   "frequency": {
    "horizon": 5,
    "visits": 1,
    "observed_visits": 4,
    "candidate_horizons": [
     5
    ],
    "ambiguous": false,
    "source": "derived"
   }
  },
  {
   "id": 19,
   "code": "30000666516",
   "lon": 113.269315,
   "lat": 23.094962,
   "frequency": {
    "horizon": 5,
    "visits": 1,
    "observed_visits": 4,
    "candidate_horizons": [
     5
    ],
    "ambiguous": false,
    "source": "derived"
   }
  },
  {
   "id": 20,
   "code": "30000666609",
   "lon": 113.2667,
   "lat": 23.093669,
   "frequency": {
    "horizon": 5,
    "visits": 1,
    "observed_visits": 4,
    "candidate_horizons": [
     5
    ],
    "ambiguous": false,
    "source": "derived"
   }
  },
  {
   "id": 21,
   "code": "30000666711",
   "lon": 113.268501,
   "lat": 23.090161,
   "frequency": {
    "horizon": 5,
    "visits": 1,
    "observed_visits": 4,
    "candidate_horizons": [
     5
    ],
    "ambiguous": false,
    "source": "derived"
   }
  },
  {
   "id": 22,
   "code": "30000698229",
   "lon": 113.261847,
   "lat": 23.098396,
   "frequency": {
    "horizon": 5,
    "visits": 1,
    "observed_visits": 4,
    "candidate_horizons": [
     5
    ],
    "ambiguous": false,
    "source": "derived"
   }
  },
  {
   "id": 23,
   "code": "30000698762",
   "lon": 113.275202,
   "lat": 23.096933,
   "frequency": {
    "horizon": 5,
    "visits": 1,
    "observed_visits": 4,
    "candidate_horizons": [
     5
    ],
    "ambiguous": false,
    "source": "derived"
   }
  },
  {
   "id": 24,
   "code": "30000715424",
   "lon": 113.28524,
   "lat": 23.098803,
   "frequency": {
    "horizon": 5,
    "visits": 1,
    "observed_visits": 4,
    "candidate_horizons": [
     5
    ],
    "ambiguous": false,
    "source": "derived"
   }
  },
  {
   "id": 25,
   "code": "30000721717",
   "lon": 113.253741,
   "lat": 23.093918,
   "frequency": {
    "horizon": 5,
    "visits": 1,
    "observed_visits": 4,
    "candidate_horizons": [
     5
    ],
    "ambiguous": false,
    "source": "derived"
   }
  },
  {
   "id": 26,
   "code": "30000748477",
   "lon": 113.28481,
   "lat": 23.099823,
   "frequency": {
    "horizon": 5,
    "visits": 1,
    "observed_visits": 4,
    "candidate_horizons": [
     5
    ],
    "ambiguous": false,
    "source": "derived"
   }
  },
  {
   "id": 27,
   "code": "30001101790",
   "lon": 113.280784,
   "lat": 23.102459,
   "frequency": {
    "horizon": 5,
    "visits": 1,
    "observed_visits": 4,
    "candidate_horizons": [
     5
    ],
    "ambiguous": false,
    "source": "derived"
   }
  },
  {
   "id": 28,
   "code": "20000714419",
   "lon": 113.270022,
   "lat": 23.102494,
   "frequency": {
    "horizon": 5,
    "visits": 1,
    "observed_visits": 4,
    "candidate_horizons": [
     5
    ],
    "ambiguous": false,
    "source": "derived"
   }
  },
  {
   "id": 29,
   "code": "20000742635",
   "lon": 113.252232,
   "lat": 23.103332,
   "frequency": {
    "horizon": 5,
    "visits": 1,
    "observed_visits": 4,
    "candidate_horizons": [
     5
    ],
    "ambiguous": false,
    "source": "derived"
   }
  },
  {
   "id": 30,
   "code": "20000748559",
   "lon": 113.267705,
   "lat": 23.104352,
   "frequency": {
    "horizon": 5,
    "visits": 1,
    "observed_visits": 4,
    "candidate_horizons": [
     5
    ],
    "ambiguous": false,
    "source": "derived"
   }
  },
  {
   "id": 31,
   "code": "20000908910",
   "lon": 113.270776,
   "lat": 23.093213,
   "frequency": {
    "horizon": 5,
    "visits": 1,
    "observed_visits": 4,
    "candidate_horizons": [
     5
    ],
    "ambiguous": false,
    "source": "derived"
   }
  },
  {
   "id": 32,
   "code": "30000219615",
   "lon": 113.265578,
   "lat": 23.106944,
   "frequency": {
    "horizon": 5,
    "visits": 1,
    "observed_visits": 4,
    "candidate_horizons": [
     5
    ],
    "ambiguous": false,
    "source": "derived"
   }
  },
  {
   "id": 33,
   "code": "30000220288",
   "lon": 113.2533,
   "lat": 23.102937,
   "frequency": {
    "horizon": 5,
    "visits": 1,
    "observed_visits": 4,
    "candidate_horizons": [
     5
    ],
    "ambiguous": false,
    "source": "derived"
   }
  },
  {
   "id": 34,
   "code": "30000223112",
   "lon": 113.271519,
   "lat": 23.103797,
   "frequency": {
    "horizon": 5,
    "visits": 1,
    "observed_visits": 4,
    "candidate_horizons": [
     5
    ],
    "ambiguous": false,
    "source": "derived"
   }
  },
  {
   "id": 35,
   "code": "30000225110",
   "lon": 113.258876,
   "lat": 23.107847,
   "frequency": {
    "horizon": 5,
    "visits": 1,
    "observed_visits": 4,
    "candidate_horizons": [
     5
    ],
    "ambiguous": false,
    "source": "derived"
   }
  },
  {
   "id": 36,
   "code": "30000241107",
   "lon": 113.251904,
   "lat": 23.104841,
   "frequency": {
    "horizon": 5,
    "visits": 1,
    "observed_visits": 4,
    "candidate_horizons": [
     5
    ],
    "ambiguous": false,
    "source": "derived"
   }
  },
  {